type,id,name,shortDescription,description,founded,website,city,country,logo/id,logo/imageServiceUrl,logo/fileName,published,industries/0,industries/1,industries/2,industries/3,industries/4,industries/5,industries/6,industries/7,industries/8,industries/9,industries/10,industries/11,industries/12,industries/13,industries/14,industries/15,industries/16,industries/17,industries/18,industries/19,industries/20,industries/21,industries/22,industries/23,industries/24,industries/25,industries/26,industries/27,industries/28,industries/29,industries/30,industries/31,industries/32,industries/33,industries/34,industries/35
startup,6224182887055360,Deal Room Events Oy,Event platform for networking,"Deal Room is a platform that gets people to meet for making deals. A meeting scheduling tool allowing participants to organise one to one meetings among themselves.
",2018-02-01T00:00:00.000Z,http://www.dealroomevents.com,Helsinki,Finland,6211775431180288,https://lh3.googleusercontent.com/vGf78KMF9krSF-5-KSzfAK46qHb5s83tnpL7wO6otvM-mivtiqJC3kTG1BGhYVORcHkPprhwdNLejSq-CEXd-rWgWhPvGJfQRBN5,Deal-Room-Logo-in-app-blue.png,true,hospitality_and_travel,e-commerce,marketing_and_communication,89590a2b-8d44-4d83-aaf9-3fad0b5ff06f,impact,,,,,,,,,,,,,,,,,,,,,,,,,,,,,,,
startup,6253094962724864,Girdit Oy,GIRDIT offers UAS operations as a service ,"Girdit provides industrial scale UAS operations as a service to its customers.  
Services include:  
* Surveying: topographical, geophysical  
* Surveillance: search & rescue, border control  
* Telecommunications: Satellite like service with increased mobility",2016-04-01T00:00:00.000Z,http://www.girdit.com/,Espoo,Finland,6279111660011520,https://lh3.googleusercontent.com/pJGFviD-7x7wlJIktNHu3dmSFvbXmhAK0nzWNVc7V_0rHQ7temGIudPZvsQMx19Mib35aTlOFMrV6246lCHA0qaWJ0UFSobZX8Wg,girdit_logo_flat.png,true,automotive_and_transportation,,,,,,,,,,,,,,,,,,,,,,,,,,,,,,,,,,,
startup,6253715082182656,ViiBE,The technology of visioassistance without download,"ViiBE helps industrial technical support and after sales services operate the best remote diagnosis, reduce experts' displacements, optimize first contact resolution rates and improve technicians and customers' satisfaction through a remote assistance experience.
Our Web application enables experts to see incidents in real time through the back camera of the interlocutor's smartphone, snap and share images or any document, draw on them, guide with augmented reality features and much more.",2018-11-01T00:00:00.000Z,http://viibe.co,Paris,France,5764529581457408,https://lh3.googleusercontent.com/vhhEdZrPdcP9-jGHNNGvM7cU77nrnBrge7rbV0-mMPUPEpIyk2M_sZo3l1nDMj7ulWyp8b7L_D_FhKis3UwDYkd1vbWXoqSKTzS6,logo_ViiBE.png,true,on-demand_services,,,,,,,,,,,,,,,,,,,,,,,,,,,,,,,,,,,
startup,6258109873913856,everynet,Internet of Things,"Everynet is a leading Low Power Wide Area (LPWA) technology network operator with access to networks around the globe including the Americas, EMEA, and APAC.",2017-06-01T00:00:00.000Z,https://everynet.com/,Espoo,Finland,4831648155697152,https://lh3.googleusercontent.com/PksRNcMfDcUJqwbgwh7Zm6sLC4sej7-GXPq20uZLmXx5voakWSRHrxm_bthwssuTPXQyAhpeT6PaoeXa-60R3N85G1_tHdGLAMmMHw,everynet_colorx2.png,true,marketing_and_communication,,,,,,,,,,,,,,,,,,,,,,,,,,,,,,,,,,,
startup,6268037187502080,Puheet.com,True. Good. Useful. Make sense of behavior,"To make optimal business decisions, one must understand customer needs, wants and desires. Invite your stakeholders to co-create and utilize all other textual feedback. 
Our solution has tools to build and manage an online community, create surveys, maintain discussions, and to present ideas with images, videos, and text. 
You get state-of-the-art analytics, insights, nice visuals and best of the breed natural language processing tools.
An example application is cutting customer churn by 50%.",2010-05-01T00:00:00.000Z,https://www.puheet.com,Espoo,Finland,6249018099236864,https://lh3.googleusercontent.com/Q2ZyCQgTjIKxzDJ-F1uRNQsnlLU_wCqyefXSuveQ1bXfy9PqUYcXP7h5mlrHhVC1KQ6tloRGTCBB0x9dT3fkv2eMsWio-RZVoSw,Logo - puheet.com - turquoise on transparent.png,true,Design,6f086252-72eb-445c-b155-a584245caa01,entertainment_and_media,financial_and_insurance,marketing_and_communication,retail,,,,,,,,,,,,,,,,,,,,,,,,,,,,,,
startup,6284668475277312,Bald & Grey Hair,Fintech,"We automate asset trading with AI.

This is how we can adapt to market changes efficiently and accordingly. Managing an automated portfolio of validated strategies helps us to avoid human biases and achieve more sustainable and reliable returns.

We are a team of aspiring financial engineers and statisticians with a courageous mindset. Our vision is to combine the power of algorithms and state of the art statistical innovation with financial markets.",2018-07-01T00:00:00.000Z,http://baldandgreyhair.com,Helsinki,Finland,5322609558290432,https://lh3.googleusercontent.com/3pN_TpCPfN6m3rL2rZ7Y3kNFcJti7eky3R6OG7VhWlyh2hu2iIhdM5NBLs9Wpp53GS8ssuadQg3DSS7eI-2QTNGt8ep2EP0yZXY,bgh_blacktext.png,true,financial_and_insurance,,,,,,,,,,,,,,,,,,,,,,,,,,,,,,,,,,,
startup,6285020595486720,Work Pilots Oy,"WorkPilots, mobile on-demand job matching platform","WorkPilots is a unique mobile-first service that connects young people in need of work with households, companies and organizations which can utilize youth to handle their seasonal, on-demand and sporadic tasks (so-called gigs). WorkPilots approach is building social impact. Organizations can easily find motivated workers at a fair price, young people gain access into the workplace, and at the same time, a positive social impact to combat youth unemployment is created. 
",2015-10-01T00:00:00.000Z,http://www.workpilots.fi,Espoo,Finland,6006029317832704,https://lh3.googleusercontent.com/opA_pS6cnn72rVDmFVIwv-Xcagtq9aDOsrK7n3SIAGDArKKINrluensKTafSKoSbYf5UiJGK4pHoM-kEZzokUkuZsHJV0Ua6iM6j,WP_logo.jpg,true,logistics,hr,on-demand_services,impact,,,,,,,,,,,,,,,,,,,,,,,,,,,,,,,,
startup,6294518445899776,Mobile Wellness Solutions MWS Oy,"Software, Health & Wellness",Wellmo is a b2b SaaS company driving the preventive digital health megatrend in insurance business and other selected segments. Our solution is a content agnostic platform enabling branded and differentiated health app leveraging local health content and services. This platform & ecosystem approach is gaining increasing traction on the market. Wellmo has paying customers in 5 European countries and is on a solid growth track at close to 100% p.a. for the third year.,2012-10-01T00:00:00.000Z,http://wellmo.com,Espoo,Finland,5698529657880576,https://lh3.googleusercontent.com/ycIeQBJ_l1HLXv0l_wkuqgHFQ3LC092VfeZvc7uZtljoK_ayNDNowg6W6-jAWvEdKTA3zd3VV2A_nrB-Q43AfrKY6_6DKkKu0Io,Wellmo_logo1.png,true,medtech,digital_health,sports,on-demand_services,,,,,,,,,,,,,,,,,,,,,,,,,,,,,,,,
startup,6332279798366208,Funzilife Oy,"Mobile service, Education","Funzi is an award-winning mobile service from Finland that delivers learning and training to everyone, everywhere.

Funzi’s mission is to provide everyone access to quality learning cost effectively, and to deliver the best learning experience on mobile - with little or no cost to the end-user.",2014-02-01T00:00:00.000Z,http://funzi.fi,Espoo,Finland,6227852634619904,https://lh3.googleusercontent.com/1_ToplzmYE6xgc7hcIFrFVLnTvYEuJwbRVDCyIyvyBe-6FOfF5wm21Z2Or-MEG63ghIA9APQySbxruzsXodiiyjZBDvRlJqfZ-mFIA,funzi-logo-900px.png,true,education,,,,,,,,,,,,,,,,,,,,,,,,,,,,,,,,,,,
startup,6494683719008256,Helpten Oy,Car as a service digital platform provider,"Provider of  CaaS digital platform for car dealers and fleet management companies with Saas Business model. Enabling bundling of car financing, parking, fuel, car wash, easy communication with IoT data from cars and integration to ecosystem partners. Car and related service is sold as a one monthly fee. In Finland we are having as our customers and partners big car dealers, Santander, Lähitapiola, Elisa, ABC, Falck. 2019 we aim to expand to  countries in Europe. We seek funding for expansion",2007-10-01T00:00:00.000Z,http://www.helpten.com,Espoo,Finland,,,,true,automotive_and_transportation,,,,,,,,,,,,,,,,,,,,,,,,,,,,,,,,,,,
startup,6551358027071488,Mapple Analytics Oy,AI powered location intelligence software,"Mapple provides an AI powered location intelligence software to help cities and real estate companies better understand the area they are developing. By applying insights on people, infrastructure and mobility they can evaluate current situation and forecast the impact of their investment. Our team is made of GIS experts, data scientists and growth hackers. We are currently looking for partners, new customers and first seed investment. ",2018-06-01T00:00:00.000Z,http://mapple.io,Helsinki,Finland,5135967023267840,https://lh3.googleusercontent.com/GGIRttiPm_2xUKpcZzAhtkvWwQjko9yab122pgaQObJu-Cj-YWU7Lfr5K1E4Wx7XZCcdT0ygTiNrByQywjq6-Fhxk_DihkRB3kR1,logo100x100.png,true,air_quality,construction_and_real_estate,automotive_and_transportation,impact,,,,,,,,,,,,,,,,,,,,,,,,,,,,,,,,
startup,6555031163633664,Solar Water Solutions Oy,MAKE DRINKING WATER WITH  ZERO EMISSIONS,"We run on solar, we run off-grid.
We run on solar, no diesel needed.
We run on solar, sunshine doesn't cost a penny.
Make drinking water with zero emissions. Revolutionary SolarRO-system helps you to produce safe and affordable water locally in remote locations. You'll avoid the transport of water and bottled water. Potable water can be made directly from seawater, lakes, rivers, ponds or boreholes.
The products are mobile and scalable to suit your capacity requirements. Powered fully by solar. ",2015-05-01T00:00:00.000Z,https://solarwatersolutions.fi/,Espoo Finland,Finland,4665096370388992,https://lh3.googleusercontent.com/gEWWMrlfbIBfs0Jyyisxg8mkdKKDcODoB0P6ycgWeYGK8WZrrf20MJp5ACmQQPA7VzVWwMe8csjP1B0grs2z11cVJ3qzWRHgn3ax,SWS-Logo kopio.jpg,true,water_and_wastewater,,,,,,,,,,,,,,,,,,,,,,,,,,,,,,,,,,,
